[
  {"skill_id":"pdf_ocr","name":"PDF OCR","description":"Turn scanned PDF pages into searchable text.","category":"document_processing","input_type":"pdf","output_type":"text","risk_level":"medium","difficulty":"advanced","dependencies":[],"typical_failure_modes":["illegible_text","page_loss"],"evaluation_criteria":["character_accuracy","page_coverage"],"source":"agentproof_seed"},
  {"skill_id":"batch_pdf_extraction","name":"Batch PDF extraction","description":"Extract complete structured content from a large collection of PDFs.","category":"document_processing","input_type":"pdf_collection","output_type":"structured_records","risk_level":"high","difficulty":"advanced","dependencies":["pdf_ocr"],"typical_failure_modes":["missed_files","truncated_content","duplicate_records"],"evaluation_criteria":["file_coverage","field_accuracy","record_uniqueness"],"source":"agentproof_seed"},
  {"skill_id":"table_extraction","name":"Table extraction","description":"Recover rows and columns from varied document layouts.","category":"document_processing","input_type":"pdf","output_type":"tabular_records","risk_level":"high","difficulty":"expert","dependencies":["pdf_ocr"],"typical_failure_modes":["column_shift","merged_cells"],"evaluation_criteria":["cell_accuracy","schema_consistency"],"source":"agentproof_seed"},
  {"skill_id":"schema_mapping","name":"Schema mapping","description":"Map extracted fields into the target data model.","category":"data_engineering","input_type":"records","output_type":"normalized_records","risk_level":"high","difficulty":"advanced","dependencies":[],"typical_failure_modes":["wrong_field_mapping","lost_nulls"],"evaluation_criteria":["field_completeness","type_correctness"],"source":"agentproof_seed"},
  {"skill_id":"csv_generation","name":"CSV generation","description":"Produce clean, importable CSV datasets.","category":"data_engineering","input_type":"records","output_type":"csv","risk_level":"medium","difficulty":"intermediate","dependencies":["schema_mapping"],"typical_failure_modes":["delimiter_errors","encoding_errors"],"evaluation_criteria":["parseability","column_consistency"],"source":"agentproof_seed"},
  {"skill_id":"data_validation","name":"Data validation","description":"Check coverage, duplicates, and field-level correctness.","category":"quality_assurance","input_type":"dataset","output_type":"validation_report","risk_level":"high","difficulty":"advanced","dependencies":[],"typical_failure_modes":["false_pass","incomplete_sampling"],"evaluation_criteria":["error_detection","coverage"],"source":"agentproof_seed"},
  {"skill_id":"citation_checking","name":"Citation checking","description":"Verify cited sources support stated claims.","category":"research","input_type":"draft","output_type":"citation_report","risk_level":"medium","difficulty":"advanced","dependencies":[],"typical_failure_modes":["broken_links","unsupported_claims"],"evaluation_criteria":["source_accuracy","claim_coverage"],"source":"agentproof_seed"},
  {"skill_id":"web_research","name":"Web research","description":"Find and synthesize reliable public sources.","category":"research","input_type":"question","output_type":"research_brief","risk_level":"medium","difficulty":"intermediate","dependencies":[],"typical_failure_modes":["stale_sources","missing_primary_sources"],"evaluation_criteria":["source_quality","recency"],"source":"agentproof_seed"}
]
